{"schema_id":"hypabolic-trajectory-v1","schema_version":1,"trajectory_id":"9faa59395a0f635c677d8b311b25ecb4fdf71bc69fb80f75da3eae549a898f2b","source":{"type":"ahp","name":"ahp","group_id":"ahp-chat:/00000000-0000-4000-8000-0000000000a3"},"segment":{"partial":false,"base_byte_offset":0},"normalizer":{"name":"Hypabolic.Trajectory","version":"0.1.0"},"config":{"bounds":{"tool_arguments":{"max_characters":20000},"tool_results":{"max_characters":2500,"strategy":"head-tail"}},"filters":{"tool_results":"include"}},"records":[{"id":"5c1414815c960fb2826b0f98c5034dcfc9aa64ee62ac13ce283c824552a15fa4","kind":"meta","role":"meta","order":-1,"source_timestamp":null,"timestamp":null,"source_name":"ahp","cwd":"/workspace/demo","model":"synthetic-model-1","provenance":{"stable_source_record_id":"meta","source_identity_kind":"synthetic","source_order_id":"0|0000-00-00T00:00:00.000Z|00000000000000000000|meta","component_key":"meta","component_index":0,"component_type_ordinal":0},"hashes":{"content_sha256":"555b0bc1d8f81eca5dba68517f69a1a6c4bd79809d4658794c723516113e49a2","record_sha256":"bb7d3f6743c6f38889772d6e56cec3e145d2d5b7d84f9bd83377a66eab43f7a6"}},{"id":"491ecfd8231d9831cea4fe5aee0be6c67eb82856edcf1f4a7154d8737ac85596","kind":"message","role":"user","order":0,"source_timestamp":"2026-03-15T14:00:00.000Z","timestamp":"2026-03-15T14:00:00.000Z","content":"Delete everything under /tmp/synthetic-scratch.","provenance":{"stable_source_record_id":"turn-00000000-0000-4000-8000-0000000000t1","source_identity_kind":"native","source_order_id":"1|2026-03-15T14:00:00.000Z|00000000000000000000|turn-00000000-0000-4000-8000-0000000000t1","component_key":"message:0","component_index":0,"component_type_ordinal":0,"native_record_id":"turn-00000000-0000-4000-8000-0000000000t1","source_sequence":0,"source_offset":0,"source_anchor_kind":"byte"},"hashes":{"content_sha256":"3dbd1a1e5193c9a4fb372f95b6cbf81353175e6b333daa311564fe4a26052fa7","record_sha256":"3cb692589e23b5b702b62dce18fbcb9ee5de8c73a096d429993c6fdf5040e54d"}},{"id":"823604fa2661c2a1303e95962e250556a02eb9556f8afeb6eb45213ba58be107","kind":"message","role":"assistant","order":1,"source_timestamp":"2026-03-15T14:00:00.000Z","timestamp":"2026-03-15T14:00:00.000Z","content":"I will start a cleanup command.","provenance":{"stable_source_record_id":"part-md-1","source_identity_kind":"native","source_order_id":"1|2026-03-15T14:00:00.000Z|00000000000000000000|part-md-1","component_key":"message:1","component_index":1,"component_type_ordinal":1,"native_record_id":"part-md-1","source_sequence":0,"source_offset":0,"source_anchor_kind":"byte"},"hashes":{"content_sha256":"7d059a523beecf25fdf1b0f91d26faef39fc99d9aafdcb380cd8db3245b5caf2","record_sha256":"6b487fd24fbe71fc02d7af59ddbada0d6be390b0bf18bef92b293a6964ef3d8d"}},{"id":"97fd9a4edc9e06717d054c94c14a2578ea1ecf8f3694229584c57c1974010ff8","kind":"assistant_tool_calls","role":"assistant","order":2,"source_timestamp":"2026-03-15T14:00:00.000Z","timestamp":"2026-03-15T14:00:00.000Z","content":null,"tool_calls":[{"id":"tc-00000000-0000-4000-8000-0000000000c1","name":"terminal","arguments_json":"{\"command\":\"rm -rf /tmp/synthetic-scratch\"}"}],"provenance":{"stable_source_record_id":"tc-00000000-0000-4000-8000-0000000000c1","source_identity_kind":"native","source_order_id":"1|2026-03-15T14:00:00.000Z|00000000000000000000|tc-00000000-0000-4000-8000-0000000000c1","component_key":"tool-call:tc-00000000-0000-4000-8000-0000000000c1","component_index":2,"component_type_ordinal":0,"native_record_id":"tc-00000000-0000-4000-8000-0000000000c1","source_sequence":0,"source_offset":0,"source_anchor_kind":"byte"},"hashes":{"content_sha256":"cc9ca0740a8e35e4dfc3609f57c28eebc6d0b288bf42c5cf3205aa674e7fc75a","record_sha256":"9dc16ea018b9b756dd0e8eb0ccf2f62191b1d15fe5369fb60e2a92b84ce09346"}},{"id":"df8381da8bc73880bccf3564f89499f6658ed6cde86a6a833e82b6362fb3d779","kind":"tool_result","role":"tool","order":3,"source_timestamp":"2026-03-15T14:00:00.000Z","timestamp":"2026-03-15T14:00:00.000Z","content":"User denied the tool call","tool_call_id":"tc-00000000-0000-4000-8000-0000000000c1","tool_name":"terminal","is_error":true,"provenance":{"stable_source_record_id":"tc-00000000-0000-4000-8000-0000000000c1","source_identity_kind":"native","source_order_id":"1|2026-03-15T14:00:00.000Z|00000000000000000000|tc-00000000-0000-4000-8000-0000000000c1","component_key":"tool-result:tc-00000000-0000-4000-8000-0000000000c1","component_index":3,"component_type_ordinal":0,"native_record_id":"tc-00000000-0000-4000-8000-0000000000c1","source_sequence":0,"source_offset":0,"source_anchor_kind":"byte"},"hashes":{"content_sha256":"9bafa1e87c1851bdcb653b3d368d4e4c313f50a0c73eaf5becfce142f6f8ebec","record_sha256":"ab390561f3b99b04db2213ef28949ccca2eab398f237e41993a9227d8cdd010a"}}],"diagnostics":[]}