{"schema_id":"hypabolic-trajectory-v1","schema_version":1,"trajectory_id":"761a5d2359f73e356bec8f135b87cb85ec4bab0dd667a24032b83cf990520e90","source":{"type":"pi","name":"pi","group_id":"pi-chunk-session"},"segment":{"partial":true,"base_byte_offset":4096},"normalizer":{"name":"Hypabolic.Trajectory","version":"0.1.0"},"config":{"bounds":{"tool_arguments":{"max_characters":20000},"tool_results":{"max_characters":2500,"strategy":"head-tail"}},"filters":{"tool_results":"include"}},"records":[{"id":"9ed4b6be2eec8276f4213761e3be07d13cd03f8eb1fc6395df866bcfacb58de0","kind":"meta","role":"meta","order":-1,"source_timestamp":null,"timestamp":null,"source_name":"pi","provenance":{"stable_source_record_id":"meta","source_identity_kind":"synthetic","source_order_id":"0|0000-00-00T00:00:00.000Z|00000000000000000000|meta","component_key":"meta","component_index":0,"component_type_ordinal":0},"hashes":{"content_sha256":"e59870288b68a2a79cc0e47e0bb3b46e1f9431e6b9b8ad7d9f0b0446fb235b39","record_sha256":"1a9529b1a68fd57532c62225fb57f4de431e5efdb52155dc22b5900b5265f680"}},{"id":"6e448800d56e6ce3df2b7381ebc7b6807c0d04ca11a1187a71b91ed6be39ed61","kind":"tool_result","role":"tool","order":0,"source_timestamp":"2026-02-03T01:35:06.789Z","timestamp":"2026-02-03T01:35:06.789Z","content":"cross-chunk result","tool_call_id":"prior-call","tool_name":"read","is_error":false,"provenance":{"stable_source_record_id":"chunk-result","source_identity_kind":"native","source_order_id":"1|2026-02-03T01:35:06.789Z|00000000000000000000|chunk-result","component_key":"tool-result:prior-call","component_index":0,"component_type_ordinal":0,"native_record_id":"chunk-result","source_sequence":0,"source_offset":0,"source_anchor_kind":"byte"},"hashes":{"content_sha256":"5fb394e2dd9014294ce3592f0477e1af7ee242980afdde94fbc5403a3fe49ee6","record_sha256":"76249cd1bfce514b6ba27e0dcf6d8bc32da3b034bfc999b9bc6487fc7962ff52"}}],"diagnostics":[]}