{"schema_id":"hypabolic-trajectory-v1","schema_version":1,"trajectory_id":"0eebe426da67a5b5fa61a85dbfe11660a18048ed88213efdce142a19e173ce2f","source":{"type":"pi","name":"pi","group_id":"unicode-session","producer_version":"3"},"segment":{"partial":false,"base_byte_offset":0},"normalizer":{"name":"Hypabolic.Trajectory","version":"0.1.0"},"config":{"bounds":{"tool_arguments":{"max_characters":120},"tool_results":{"max_characters":10,"strategy":"head-tail"}},"filters":{"tool_results":"include"}},"records":[{"id":"a9e11e3b2a719d3cfdd1f3e5cb479e7af3db925e2eac837139b978dcc5d04809","kind":"meta","role":"meta","order":-1,"source_timestamp":null,"timestamp":null,"source_name":"pi","cwd":"/tmp/é-\uD83D\uDE00","model":"test-model","producer_version":"3","provenance":{"stable_source_record_id":"meta","source_identity_kind":"synthetic","source_order_id":"0|0000-00-00T00:00:00.000Z|00000000000000000000|meta","component_key":"meta","component_index":0,"component_type_ordinal":0},"hashes":{"content_sha256":"fc32819f2950933c64eb42a780a0b7442aa35300f5286794e54ab27020a97a72","record_sha256":"679545a269942c129dd65e767b2ba88245bd92dfce664eaf3015bfeda4092268"}},{"id":"35122c25b980b25fbf749ba1f165c0b1e1fb1528018754f224496dc7eafc45e9","kind":"message","role":"user","order":0,"source_timestamp":"2025-12-31T18:30:01.123Z","timestamp":"2025-12-31T18:30:01.123Z","content":"Preserve é and \uD83D\uDE00; escape \"quote\", \\slash, tab\t and line\nbreak.","provenance":{"stable_source_record_id":"unicode-user","source_identity_kind":"native","source_order_id":"1|2025-12-31T18:30:01.123Z|00000000000000000001|unicode-user","component_key":"message:0","component_index":0,"component_type_ordinal":0,"native_record_id":"unicode-user","source_sequence":1,"source_offset":124,"source_anchor_kind":"byte"},"hashes":{"content_sha256":"3b3d50817a88d4f5b4d1ff1cf9c9b2d5e5ad6f855476ca5633f8ca2f281d6a76","record_sha256":"dfc304a9c26afd53132cb6c05b0643fd521a671c943d6a6869b820baaa4b6fbe"}},{"id":"01e51b03fc0a4c8bcc836466ebc597858fd515c1400590ed32dc06000dc54ec3","kind":"tool_result","role":"tool","order":1,"source_timestamp":"2025-12-31T18:30:03.123Z","timestamp":"2025-12-31T18:30:03.123Z","content":"αβγ\uD83D\uDE00e…りXYZ","tool_call_id":"unicode-call","tool_name":"probe","is_error":false,"provenance":{"stable_source_record_id":"unicode-result","source_identity_kind":"native","source_order_id":"1|2025-12-31T18:30:03.123Z|00000000000000000002|unicode-result","component_key":"tool-result:unicode-call","component_index":0,"component_type_ordinal":0,"native_record_id":"unicode-result","source_sequence":2,"source_offset":368,"source_anchor_kind":"byte"},"hashes":{"content_sha256":"04d2f9b723acb75afe79cd59ca807ddd0bb2997fbe5065e3827a77f62057d66d","record_sha256":"5283c727479d39f0c86d1e6612bd9dfc97761716de196402aaf400fe25fad0db"}},{"id":"6481f8b138c2688334995488be8b272c9e8733acd022054a48dd8cddcab201a3","kind":"assistant_tool_calls","role":"assistant","order":2,"source_timestamp":"2025-12-31T18:30:02.123Z","timestamp":"2025-12-31T18:30:02.123Z","content":null,"tool_calls":[{"id":"unicode-call","name":"probe","arguments_json":"{\"\\uE000\":\"bmp-private\",\"\\uD800\\uDC00\":\"\",\"combining\":\"é\",\"emoji\":\"\\uD83D\\uDE00\",\"escaped\":\"\\\"\\\\\\b\\f\\n\\r\\t\"}"}],"provenance":{"stable_source_record_id":"unicode-assistant","source_identity_kind":"native","source_order_id":"1|2025-12-31T18:30:02.123Z|00000000000000000003|unicode-assistant","component_key":"tool-call:unicode-call","component_index":0,"component_type_ordinal":0,"native_record_id":"unicode-assistant","source_sequence":3,"source_offset":636,"source_anchor_kind":"byte"},"hashes":{"content_sha256":"eedc8a25273509e8a96db84e70cbc0844e0a8eccfc1d54a31f6561d6ff3db9b8","record_sha256":"cdab9706f5e0221228173ac45baf077e6445d7d701863f5b6670b0072a4ad39c"}},{"id":"2bd5758d15dee12d37eaf634dcef9f8c44686cd22fd92f5239b299f6d350caad","kind":"message","role":"assistant","order":3,"source_timestamp":"2025-12-31T18:30:04.123Z","timestamp":"2025-12-31T18:30:04.123Z","content":"Done \uD83D\uDE00","provenance":{"stable_source_record_id":"unicode-final","source_identity_kind":"native","source_order_id":"1|2025-12-31T18:30:04.123Z|00000000000000000004|unicode-final","component_key":"message:0","component_index":0,"component_type_ordinal":0,"native_record_id":"unicode-final","source_sequence":4,"source_offset":1172,"source_anchor_kind":"byte"},"hashes":{"content_sha256":"f36b69205a8cd5049f73777d9930232cd20225ed3ed240ac96f85301292fef80","record_sha256":"8e4d8b0a8c1030eca70932b1c1c0e88fb32a18bb4e4da23d1389035551800ee4"}}],"diagnostics":[{"code":"tool_result_truncated","message":"Truncated the result for tool call \"unicode-call\" to at most 10 Unicode code points using the \"head-tail\" strategy.","input_line":3,"record_index":2},{"code":"tool_arguments_truncated","message":"Truncated arguments for tool call \"unicode-call\" to at most 120 Unicode code points.","input_line":4,"record_index":3}]}